ts,sessionId,page,auth,level,itemInSession,city,zip,state,userAgent,lon,lat,userId,lastName,firstName,gender,registration,artist,song,duration
1707648620,2912,/new-releases,Logged Out,free,9,Boyer,,,"Mozilla/5.0 (iPod; U; CPU iPhone OS 3_0 like Mac OS X; fo-FO) AppleWebKit/534.38.6 (KHTML, like Gecko) Version/3.0.5 Mobile/8B119 Safari/6534.38.6",-165.565845,-25.8190885,,,,,,Bob Dylan,Mr. Tambourine Man,209
1708575694,5418,/explore,Logged In,free,41,Almeida Grande,45307579-613,AL,Mozilla/5.0 (compatible; MSIE 7.0; Windows 98; Win 9x 4.90; Trident/5.0),-171.168997,27.933821,81268.0,Spence,John,M,1704242817.0,Ed Sheeran,Thinking Out Loud,182
1707308714,4155,/my-music,Logged In,paid,81,Farias,32299181-996,SC,"Mozilla/5.0 (Windows CE) AppleWebKit/533.1 (KHTML, like Gecko) Chrome/28.0.811.0 Safari/533.1",-80.825164,63.5651995,46707.0,Mitchell,Ashlee,M,1706569737.0,Mariah Carey,Without You,202
1707759515,863,/explore,Logged Out,free,3,Meganton,,NB,Mozilla/5.0 (compatible; MSIE 6.0; Windows NT 11.0; Trident/3.1),-153.836906,60.3130325,,,,,,Mariah Carey,Without You,202
1705844180,4971,/songs,Logged Out,free,29,West Jessica,,DC,Opera/9.63.(Windows 95; sr-RS) Presto/2.9.174 Version/11.00,-4.193494,-22.550605,,,,,,Bruce Springsteen,Born in the U.S.A.,293
1704546305,3012,/new-releases,Logged Out,free,82,Baillonville,,,Mozilla/5.0 (Android 3.2.5; Mobile; rv:66.0) Gecko/66.0 Firefox/66.0,-45.682074,-26.9731445,,,,,,Michael Jackson,Thriller,271
1705496129,2940,/albums,Logged In,paid,15,Ramos,62513-135-402,SP,"Mozilla/5.0 (Macintosh; U; Intel Mac OS X 10_11_4) AppleWebKit/534.0 (KHTML, like Gecko) Chrome/29.0.888.0 Safari/534.0",35.501537,-36.4247835,98616.0,Kim,Sharon,M,1707808954.0,Mariah Carey,We Belong Together,299
1705241008,1025,/new-releases,Logged In,free,54,Port Gregoryburgh,79460,OH,"Mozilla/5.0 (iPod; U; CPU iPhone OS 4_0 like Mac OS X; pl-PL) AppleWebKit/535.43.1 (KHTML, like Gecko) Version/3.0.5 Mobile/8B117 Safari/6535.43.1",-153.045695,-26.800312,88960.0,Douglas,Kristie,F,1706059447.0,Adele,Someone Like You,185
1706742696,7595,/new-releases,Logged Out,free,37,Evrard,,,"Mozilla/5.0 (X11; Linux x86_64) AppleWebKit/532.2 (KHTML, like Gecko) Chrome/17.0.840.0 Safari/532.2",21.553606,-11.427703,,,,,,The Rolling Stones,Sympathy for the Devil,203
1706523883,367,/songs,Logged In,free,85,Vangside,Y1B 8E4,NL,Mozilla/5.0 (Macintosh; Intel Mac OS X 10_6_9; rv:1.9.5.20) Gecko/8474-03-06 19:28:44 Firefox/11.0,-166.532202,83.8989855,79545.0,Rosales,Robert,F,1707759750.0,Michael Jackson,Billie Jean,242
1707534115,4599,/new-releases,Logged In,paid,56,Trevorchester,82152,KS,"Mozilla/5.0 (Macintosh; PPC Mac OS X 10_10_3 rv:2.0; or-IN) AppleWebKit/534.32.4 (KHTML, like Gecko) Version/4.1 Safari/534.32.4",107.406869,57.8935235,3729.0,Gould,Melissa,M,1706269747.0,David Bowie,Life on Mars?,297
1706288428,4931,/songs,Logged In,paid,20,Paulmouth,X9S 6A5,NU,Mozilla/5.0 (compatible; MSIE 8.0; Windows NT 11.0; Trident/4.0),142.926632,-29.1647065,43740.0,Butler,Brandon,F,1706784632.0,Led Zeppelin,Stairway to Heaven,183
1706809588,8207,/explore,Logged Out,free,72,Masse-sur-Bertrand,,,Mozilla/5.0 (compatible; MSIE 9.0; Windows 98; Win 9x 4.90; Trident/5.1),43.353657,58.7303995,,,,,,Frank Sinatra,Strangers in the Night,259
1706361540,6953,/new-releases,Logged Out,free,91,East Raymond,,GU,"Mozilla/5.0 (Linux; Android 7.1.1) AppleWebKit/532.1 (KHTML, like Gecko) Chrome/56.0.884.0 Safari/532.1",-4.15903,-1.081489,,,,,,Mariah Carey,Without You,202
1706241076,3277,/albums,Logged In,free,27,South Jessicaberg,39286,FL,Opera/8.99.(X11; Linux x86_64; en-AU) Presto/2.9.160 Version/12.00,-176.060843,13.0257205,78087.0,Terry,Raymond,F,1704227755.0,Led Zeppelin,Rock and Roll,287
1705880332,1530,/explore,Logged Out,free,100,Hammondbury,,NV,"Mozilla/5.0 (X11; Linux x86_64) AppleWebKit/534.0 (KHTML, like Gecko) Chrome/40.0.879.0 Safari/534.0",-171.224848,47.253376,,,,,,Michael Jackson,Man in the Mirror,190
1704559385,1827,/songs,Logged Out,free,12,Saint FrançoisVille,,,Mozilla/5.0 (Windows NT 5.0; bho-IN; rv:1.9.1.20) Gecko/4669-11-16 10:39:44 Firefox/3.6.20,32.692386,-81.8994145,,,,,,Whitney Houston,How Will I Know,264
1708363169,8754,/my-music,Logged In,free,29,West Erin,E4N 5K7,NL,Mozilla/5.0 (X11; Linux x86_64; rv:1.9.5.20) Gecko/3341-08-26 08:10:28 Firefox/3.8,-168.847534,67.9667575,81641.0,Benson,Kristen,F,1705243447.0,Bruce Springsteen,Born in the U.S.A.,293
1704241206,8836,/albums,Logged In,free,61,Sint-Kornelis-Horebeke,4296,,Opera/9.25.(Windows NT 6.0; ts-ZA) Presto/2.9.164 Version/12.00,-151.330069,-86.9604935,67789.0,Knight,Eric,M,1708385588.0,Michael Jackson,Smooth Criminal,269
1708881522,2396,/explore,Logged In,paid,86,Lake Jamesberg,66595,OK,Mozilla/5.0 (compatible; MSIE 7.0; Windows NT 6.2; Trident/5.1),-66.298148,-16.599067,90642.0,Rivera,Stacey,M,1706812937.0,Bob Dylan,Blowin’ in the Wind,235
1709079742,7627,/explore,Logged Out,free,77,Christopherfurt,,ON,Mozilla/5.0 (Windows NT 6.2; si-LK; rv:1.9.1.20) Gecko/7803-12-27 22:44:29 Firefox/3.8,62.234163,-54.3964715,,,,,,Led Zeppelin,Stairway to Heaven,183
1705996863,5978,/artists,Logged In,paid,95,Williamberg,C5B 5B8,SK,Opera/8.91.(Windows NT 5.01; ru-RU) Presto/2.9.162 Version/12.00,48.572752,-8.380845,30796.0,Gibson,Cindy,M,1706614406.0,Bob Dylan,Like a Rolling Stone,230
1708419513,6017,/discover,Logged In,free,88,Klein,19261,,"Mozilla/5.0 (Macintosh; U; PPC Mac OS X 10_9_9 rv:3.0; mag-IN) AppleWebKit/534.8.7 (KHTML, like Gecko) Version/4.0.3 Safari/534.8.7",-7.575416,70.8526445,35990.0,Howard,Vicki,M,1704902124.0,Prince,1999,187
1704132201,8169,/new-releases,Logged Out,free,77,Fontaine-Valmont,,,Mozilla/5.0 (compatible; MSIE 8.0; Windows NT 5.1; Trident/3.0),-124.26609,-26.883746,,,,,,Adele,Someone Like You,185
1707038138,2967,/new-releases,Logged In,paid,2,Saint Anouk-sur-Mer,24858,,Opera/9.64.(Windows 95; so-KE) Presto/2.9.173 Version/10.00,178.134468,-86.313881,60604.0,Walter,Alan,F,1706344411.0,Bruce Springsteen,Dancing in the Dark,259
1708821864,8874,/songs,Logged Out,free,16,Jesus da Praia,,MT,"Mozilla/5.0 (Macintosh; U; Intel Mac OS X 10_8_7 rv:6.0; kl-GL) AppleWebKit/535.27.6 (KHTML, like Gecko) Version/4.0 Safari/535.27.6",160.077854,57.078412,,,,,,Ed Sheeran,Photograph,191
1708208874,7388,/explore,Logged Out,free,61,North Ebonyland,,NB,Mozilla/5.0 (compatible; MSIE 6.0; Windows NT 11.0; Trident/4.0),28.434993,20.340903,,,,,,David Bowie,Heroes,226
1707331997,7916,/playlists,Logged In,free,4,Chevron,9375,,"Mozilla/5.0 (Windows NT 6.2) AppleWebKit/536.2 (KHTML, like Gecko) Chrome/13.0.898.0 Safari/536.2",-37.723593,-67.934601,37602.0,Sullivan,Joanne,F,1708682472.0,Whitney Houston,Saving All My Love for You,249
1708829413,2154,/albums,Logged In,free,60,Lopes da Serra,29244564-172,RS,Opera/8.50.(X11; Linux i686; tt-RU) Presto/2.9.162 Version/12.00,-9.037841,77.7119605,23842.0,Rodriguez,Taylor,M,1708280091.0,Led Zeppelin,Black Dog,243
1708144051,8677,/discover,Logged In,paid,78,Alves,58735-141-886,CE,"Mozilla/5.0 (Macintosh; PPC Mac OS X 10_11_0 rv:6.0; fa-IR) AppleWebKit/531.32.2 (KHTML, like Gecko) Version/5.0 Safari/531.32.2",145.217833,42.7686805,81438.0,Carter,Eric,F,1705284128.0,Taylor Swift,Blank Space,206
1706718200,297,/new-releases,Logged Out,free,96,Sainte François-sur-Mer,,,Opera/9.89.(Windows 98; Win 9x 4.90; ps-AF) Presto/2.9.162 Version/10.00,135.26291,48.242143,,,,,,Rihanna,We Found Love,182
1706843598,4078,/new-releases,Logged In,paid,96,Arsimont,6655,,Mozilla/5.0 (compatible; MSIE 6.0; Windows NT 11.0; Trident/4.0),-21.071447,-10.6945625,97103.0,English,Olivia,F,1706570931.0,Michael Jackson,Thriller,271
1705113860,3154,/explore,Logged Out,free,44,Orgeo,,,"Mozilla/5.0 (iPad; CPU iPad OS 12_4_8 like Mac OS X) AppleWebKit/533.2 (KHTML, like Gecko) FxiOS/18.9z5521.0 Mobile/25I920 Safari/533.2",-95.336764,-62.282708,,,,,,Beyoncé,Irreplaceable,277
1704885950,5390,/playlists,Logged In,paid,63,Lake Rebecca,02838,KY,"Mozilla/5.0 (Macintosh; Intel Mac OS X 10_6_6 rv:6.0; lv-LV) AppleWebKit/533.33.2 (KHTML, like Gecko) Version/5.0 Safari/533.33.2",-57.291523,-89.700682,84007.0,Maxwell,Michael,F,1704713749.0,Adele,Skyfall,198
1707034611,703,/explore,Logged Out,free,22,Cavalcanti do Galho,,TO,Mozilla/5.0 (compatible; MSIE 5.0; Windows NT 10.0; Trident/4.1),-100.029107,66.900159,,,,,,Elvis Presley,Heartbreak Hotel,196
1706091938,4527,/explore,Logged Out,free,89,Ingelmunster,,,Mozilla/5.0 (Android 8.0.0; Mobile; rv:64.0) Gecko/64.0 Firefox/64.0,50.966385,-80.9974315,,,,,,Elton John,Your Song,217
1705824875,1094,/my-music,Logged In,paid,52,Nelsonport,T4P4N3,NB,Mozilla/5.0 (Windows NT 6.1; mai-IN; rv:1.9.0.20) Gecko/8231-05-06 17:54:48 Firefox/3.6.2,156.082847,31.390757,35049.0,Elliott,Robert,M,1707008982.0,The Rolling Stones,Gimme Shelter,291
1706432418,3266,/explore,Logged Out,free,26,New Mathewshire,,NB,"Mozilla/5.0 (iPad; CPU iPad OS 12_4_4 like Mac OS X) AppleWebKit/532.2 (KHTML, like Gecko) CriOS/32.0.856.0 Mobile/19P099 Safari/532.2",-150.835583,67.1786535,,,,,,Rihanna,Diamonds,199
1705724747,1352,/charts,Logged In,free,39,Loiseau,60590,,Mozilla/5.0 (compatible; MSIE 5.0; Windows NT 5.0; Trident/3.1),83.750646,49.665283,29921.0,Crane,Courtney,M,1709129774.0,Mariah Carey,Fantasy,194
1706144208,3615,/songs,Logged Out,free,91,East Cynthia,,YT,"Mozilla/5.0 (Macintosh; PPC Mac OS X 10_8_6 rv:6.0; dz-BT) AppleWebKit/535.6.2 (KHTML, like Gecko) Version/4.0.5 Safari/535.6.2",-107.470834,3.733416,,,,,,Frank Sinatra,My Way,258
1707504764,9960,/explore,Logged Out,free,42,Sainte FrançoisBourg,,,"Mozilla/5.0 (iPhone; CPU iPhone OS 17_1_2 like Mac OS X) AppleWebKit/536.2 (KHTML, like Gecko) FxiOS/12.1t0458.0 Mobile/46A510 Safari/536.2",-107.687163,-74.5632365,,,,,,Adele,Set Fire to the Rain,199
1705319024,9150,/playlists,Logged In,paid,48,Jonesville,S5S9C7,NT,Mozilla/5.0 (compatible; MSIE 7.0; Windows NT 5.0; Trident/4.0),-104.000785,88.7366395,33896.0,Graham,Melissa,F,1704164790.0,Led Zeppelin,Kashmir,253
1708704427,5444,/new-releases,Logged In,free,78,Pineaudan,59982,,"Mozilla/5.0 (Windows CE) AppleWebKit/532.0 (KHTML, like Gecko) Chrome/61.0.839.0 Safari/532.0",-42.127103,62.9019315,64683.0,Mathis,Laura,M,1708252020.0,Beyoncé,Halo,299
1704584558,4563,/songs,Logged Out,free,35,Rodrigues,,AL,Opera/8.82.(Windows 98; Win 9x 4.90; sr-RS) Presto/2.9.185 Version/11.00,-38.527071,-70.1068195,,,,,,Frank Sinatra,I’ve Got You Under My Skin,282
1705166595,7886,/explore,Logged Out,free,34,Duarteburgh,,AS,Opera/9.35.(X11; Linux x86_64; csb-PL) Presto/2.9.165 Version/11.00,12.274229,80.116068,,,,,,Beyoncé,Halo,299
1705366213,8969,/new-releases,Logged In,free,68,Aparecida do Amparo,01041-486-639,DF,"Mozilla/5.0 (X11; Linux i686) AppleWebKit/531.2 (KHTML, like Gecko) Chrome/52.0.827.0 Safari/531.2",-76.286016,71.6428955,98402.0,Foster,Daniel,M,1706264144.0,The Beatles,Yesterday,233
1705836308,683,/artists,Logged In,paid,93,Fonseca,71815-412-455,AM,Opera/8.54.(X11; Linux i686; zu-ZA) Presto/2.9.180 Version/10.00,137.443165,50.4726385,22481.0,Phillips,Walter,M,1706277823.0,Madonna,Like a Virgin,248
1704184530,3665,/new-releases,Logged Out,free,27,Leão da Praia,,AC,"Mozilla/5.0 (Windows; U; Windows NT 6.0) AppleWebKit/531.6.6 (KHTML, like Gecko) Version/5.0 Safari/531.6.6",-175.62829,74.767868,,,,,,Frank Sinatra,I’ve Got You Under My Skin,282
1707353406,6275,/explore,Logged Out,free,12,Gibsonstad,,FM,"Mozilla/5.0 (iPhone; CPU iPhone OS 17_1 like Mac OS X) AppleWebKit/533.1 (KHTML, like Gecko) FxiOS/10.9x6362.0 Mobile/21V509 Safari/533.1",-142.221866,47.047261,,,,,,Elton John,Candle in the Wind,250
1706474552,1288,/songs,Logged Out,free,5,da Mota do Sul,,BA,"Mozilla/5.0 (Windows NT 4.0) AppleWebKit/531.0 (KHTML, like Gecko) Chrome/23.0.817.0 Safari/531.0",-123.727481,-49.6294815,,,,,,Adele,Someone Like You,185
1707121450,8018,/new-releases,Logged Out,free,25,Sainte Théophilenec,,,Mozilla/5.0 (compatible; MSIE 8.0; Windows NT 5.2; Trident/5.1),105.824249,47.611442,,,,,,Bruce Springsteen,Thunder Road,191
1706837676,4098,/albums,Logged In,free,25,East Stephenchester,C4X1L5,ON,"Mozilla/5.0 (Windows; U; Windows CE) AppleWebKit/532.44.2 (KHTML, like Gecko) Version/5.0 Safari/532.44.2",-30.27522,49.358023,25197.0,Graves,Matthew,F,1705679462.0,Elton John,Saturday Night’s Alright for Fighting,188
1704121397,9189,/discover,Logged In,paid,41,Mirandafort,93502,NE,"Mozilla/5.0 (Windows; U; Windows NT 6.0) AppleWebKit/533.1.7 (KHTML, like Gecko) Version/5.0.4 Safari/533.1.7",-132.774671,-2.4191395,26580.0,Gallagher,Kristin,M,1708198530.0,Rihanna,Work,295
1704638432,430,/songs,Logged Out,free,12,Patrickshire,,NH,"Mozilla/5.0 (Macintosh; PPC Mac OS X 10_11_1) AppleWebKit/534.2 (KHTML, like Gecko) Chrome/51.0.879.0 Safari/534.2",-3.977947,-15.891509,,,,,,Mariah Carey,Fantasy,194
1708452820,8877,/artists,Logged In,free,27,Trivières,3537,,Opera/8.38.(X11; Linux i686; hsb-DE) Presto/2.9.177 Version/11.00,-80.992578,32.6354855,11889.0,Arellano,James,F,1707937349.0,Whitney Houston,How Will I Know,264
1707315675,950,/explore,Logged Out,free,31,da Costa,,RS,Mozilla/5.0 (compatible; MSIE 8.0; Windows NT 10.0; Trident/5.1),82.865882,-14.806381,,,,,,Led Zeppelin,Rock and Roll,287
1707188823,3449,/charts,Logged In,free,23,Silveira,77793-488-322,TO,Mozilla/5.0 (compatible; MSIE 5.0; Windows NT 5.01; Trident/4.1),54.655361,67.8021165,74237.0,Stephens,Danielle,M,1706048595.0,The Rolling Stones,Gimme Shelter,291
1705430133,8326,/new-releases,Logged In,free,43,Tintigny,3649,,Mozilla/5.0 (X11; Linux x86_64; rv:1.9.6.20) Gecko/4686-07-10 18:19:27 Firefox/13.0,77.15866,9.301565,51694.0,Brown,Allen,M,1708945775.0,Whitney Houston,I Will Always Love You,243
1708489361,6904,/songs,Logged Out,free,54,das Neves do Galho,,AL,"Mozilla/5.0 (iPhone; CPU iPhone OS 17_2_1 like Mac OS X) AppleWebKit/531.1 (KHTML, like Gecko) CriOS/14.0.848.0 Mobile/84D334 Safari/531.1",175.962788,-56.3909295,,,,,,Frank Sinatra,I’ve Got You Under My Skin,282
1705854091,3882,/explore,Logged In,paid,56,Abreu da Praia,21498-287-463,MA,"Mozilla/5.0 (Macintosh; U; Intel Mac OS X 10_7_6 rv:5.0; lij-IT) AppleWebKit/534.37.1 (KHTML, like Gecko) Version/5.0 Safari/534.37.1",-47.938073,-8.8276225,38945.0,Conley,Daniel,F,1708920943.0,The Rolling Stones,Paint It Black,182
1705057823,9773,/my-music,Logged In,free,89,Georgeburgh,75019,GA,Mozilla/5.0 (Android 10; Mobile; rv:35.0) Gecko/35.0 Firefox/35.0,-140.242509,73.814266,21134.0,Mcdowell,Matthew,F,1706479762.0,Ed Sheeran,Thinking Out Loud,182
1708554428,8671,/explore,Logged Out,free,65,das Neves de Cirino,,RR,Opera/8.58.(Windows NT 11.0; be-BY) Presto/2.9.160 Version/10.00,-37.086328,-14.4228025,,,,,,Mariah Carey,All I Want for Christmas Is You,225
1705481748,8290,/new-releases,Logged Out,free,61,West Vincent,,NU,Mozilla/5.0 (compatible; MSIE 8.0; Windows 98; Trident/5.0),-53.02892,78.547848,,,,,,Prince,Purple Rain,220
1705788730,993,/discover,Logged In,paid,94,Fogaça,29361-968-892,SP,"Mozilla/5.0 (X11; Linux i686) AppleWebKit/536.1 (KHTML, like Gecko) Chrome/18.0.836.0 Safari/536.1",126.053798,17.8040605,1896.0,Lee,Frederick,M,1706486957.0,Adele,Someone Like You,185
1708909369,8409,/songs,Logged In,free,78,Brito do Campo,08987153-611,MG,"Mozilla/5.0 (Linux; Android 7.1) AppleWebKit/531.0 (KHTML, like Gecko) Chrome/16.0.842.0 Safari/531.0",-167.994422,59.55808,57091.0,Moss,Jennifer,M,1704366797.0,Bruce Springsteen,Dancing in the Dark,259
1707353588,6891,/songs,Logged Out,free,41,Siqueira Verde,,MT,"Mozilla/5.0 (iPhone; CPU iPhone OS 15_8_2 like Mac OS X) AppleWebKit/536.1 (KHTML, like Gecko) CriOS/20.0.891.0 Mobile/62G858 Safari/536.1",95.854174,-63.2258835,,,,,,Elvis Presley,Suspicious Minds,183
1708927165,9632,/explore,Logged Out,free,19,Sainte Charlotte,,,"Mozilla/5.0 (iPhone; CPU iPhone OS 9_3_5 like Mac OS X) AppleWebKit/533.0 (KHTML, like Gecko) FxiOS/11.7r2212.0 Mobile/80G021 Safari/533.0",138.255587,57.0574175,,,,,,Whitney Houston,I Will Always Love You,243
1708751620,5722,/explore,Logged Out,free,81,Boorsem,,,"Mozilla/5.0 (Windows; U; Windows NT 4.0) AppleWebKit/535.13.6 (KHTML, like Gecko) Version/4.0.3 Safari/535.13.6",-53.886282,-75.409051,,,,,,Bruce Springsteen,Dancing in the Dark,259
1705437712,3458,/new-releases,Logged Out,free,39,North Robertville,,NT,Opera/8.45.(X11; Linux x86_64; lv-LV) Presto/2.9.172 Version/10.00,94.453943,-44.8248865,,,,,,Whitney Houston,I Will Always Love You,243
1705650717,6003,/songs,Logged In,paid,46,Hoareau-sur-Briand,45392,,Opera/8.68.(Windows CE; pt-BR) Presto/2.9.173 Version/11.00,-2.671206,-49.295547,13772.0,Phillips,Jeffrey,F,1709031269.0,David Bowie,Space Oddity,242
1704239220,7386,/discover,Logged In,free,95,Sint-Pieters-Leeuw,5429,,Mozilla/5.0 (compatible; MSIE 5.0; Windows NT 4.0; Trident/4.0),-175.545119,68.5133835,21426.0,Peterson,Shannon,M,1705045940.0,Led Zeppelin,Kashmir,253
1707129412,4689,/charts,Logged In,paid,44,Lake Thomaston,53003,SC,"Mozilla/5.0 (Windows NT 10.0) AppleWebKit/533.2 (KHTML, like Gecko) Chrome/57.0.893.0 Safari/533.2",45.804456,17.327165,1899.0,Williams,Charles,M,1704719959.0,Prince,1999,187
1705724617,3873,/my-music,Logged In,paid,80,Jollain-Merlin,6597,,"Mozilla/5.0 (Macintosh; U; Intel Mac OS X 10_7_6) AppleWebKit/534.1 (KHTML, like Gecko) Chrome/33.0.824.0 Safari/534.1",121.049613,85.43839,82838.0,Hayes,Caitlin,F,1707127185.0,Madonna,Like a Prayer,270
1704777801,4931,/explore,Logged Out,free,93,North Austin,,MP,Mozilla/5.0 (Android 14; Mobile; rv:32.0) Gecko/32.0 Firefox/32.0,-51.648308,-16.1906065,,,,,,Taylor Swift,Cardigan,294
1706394747,5062,/explore,Logged Out,free,92,Port Brookemouth,,NT,"Mozilla/5.0 (Windows; U; Windows 98; Win 9x 4.90) AppleWebKit/535.14.4 (KHTML, like Gecko) Version/4.0 Safari/535.14.4",161.145433,-35.896856,,,,,,Elton John,Your Song,217
1709123192,38,/artists,Logged In,free,69,Castro do Norte,27339-168-907,RN,Mozilla/5.0 (compatible; MSIE 7.0; Windows CE; Trident/5.1),-17.581642,18.086631,216.0,Luna,Kimberly,M,1705939934.0,Michael Jackson,Man in the Mirror,190
1706649013,132,/songs,Logged Out,free,75,Milmort,,,Opera/8.95.(Windows NT 6.2; wa-BE) Presto/2.9.187 Version/12.00,17.70811,-7.360297,,,,,,Pink Floyd,Comfortably Numb,292
1707697491,6888,/songs,Logged Out,free,64,Whiteheadbury,,SK,"Mozilla/5.0 (X11; Linux i686) AppleWebKit/531.2 (KHTML, like Gecko) Chrome/62.0.813.0 Safari/531.2",57.52106,-66.821243,,,,,,Taylor Swift,Lover,222
1705270663,2980,/new-releases,Logged Out,free,30,MunozVille,,,Mozilla/5.0 (compatible; MSIE 5.0; Windows NT 5.0; Trident/3.0),-65.252645,1.184356,,,,,,The Beatles,Hey Jude,219
1707732662,4329,/charts,Logged In,paid,84,Farias de Abreu,48858415-114,BA,"Mozilla/5.0 (iPhone; CPU iPhone OS 12_4_8 like Mac OS X) AppleWebKit/533.2 (KHTML, like Gecko) CriOS/25.0.899.0 Mobile/15N701 Safari/533.2",-12.743699,-39.8559385,1477.0,Cortez,Angela,M,1704456092.0,Led Zeppelin,Rock and Roll,287
1708164229,2467,/charts,Logged In,paid,34,Wielsbeke,3529,,Opera/8.63.(Windows NT 11.0; tcy-IN) Presto/2.9.186 Version/11.00,138.986788,16.3670305,64624.0,Carlson,Courtney,M,1704252094.0,Beyoncé,Crazy in Love,263
1704858607,9027,/playlists,Logged In,paid,53,Borges,06435720-869,AP,"Mozilla/5.0 (iPod; U; CPU iPhone OS 3_1 like Mac OS X; bhb-IN) AppleWebKit/535.2.1 (KHTML, like Gecko) Version/3.0.5 Mobile/8B119 Safari/6535.2.1",67.119898,-6.457886,42309.0,Rogers,Andrew,M,1707174002.0,The Beatles,Come Together,242
1709029370,6746,/charts,Logged In,paid,49,Ribeiro,56467-373-804,MG,Mozilla/5.0 (Macintosh; U; Intel Mac OS X 10_10_5; rv:1.9.5.20) Gecko/7931-05-18 15:28:22 Firefox/3.8,138.010255,37.478197,78083.0,Preston,Amanda,M,1704680823.0,Ed Sheeran,Castle on the Hill,251
1707013408,9262,/my-music,Logged In,paid,70,Brito Grande,58202850-445,MG,Mozilla/5.0 (compatible; MSIE 8.0; Windows 98; Win 9x 4.90; Trident/5.1),-5.565333,36.99839,35293.0,Ryan,Patrick,M,1705408693.0,Adele,Set Fire to the Rain,199
1706348306,603,/songs,Logged Out,free,50,East Ashley,,BC,Mozilla/5.0 (Android 4.4.4; Mobile; rv:18.0) Gecko/18.0 Firefox/18.0,-80.025285,-79.07757,,,,,,The Rolling Stones,Angie,223
1706194650,5856,/my-music,Logged In,free,25,Sheaview,S9X5H3,NB,"Mozilla/5.0 (Macintosh; U; PPC Mac OS X 10_11_0 rv:2.0; hi-IN) AppleWebKit/532.31.4 (KHTML, like Gecko) Version/4.0 Safari/532.31.4",-109.5389,-72.921412,60059.0,Wright,Clayton,F,1708650212.0,Mariah Carey,All I Want for Christmas Is You,225
1707551693,4545,/new-releases,Logged Out,free,83,North Donna,,AL,Mozilla/5.0 (Windows 95; te-IN; rv:1.9.2.20) Gecko/9126-06-06 09:34:13 Firefox/3.8,-127.043946,-38.257797,,,,,,Mariah Carey,Fantasy,194
1706496997,6259,/songs,Logged Out,free,38,Delorme-sur-Dupont,,,"Mozilla/5.0 (iPad; CPU iPad OS 14_8_1 like Mac OS X) AppleWebKit/536.2 (KHTML, like Gecko) CriOS/57.0.814.0 Mobile/67D119 Safari/536.2",43.29216,-11.9678625,,,,,,Taylor Swift,Shake It Off,253
1704361041,9527,/songs,Logged Out,free,75,Brianbury,,LA,Mozilla/5.0 (compatible; MSIE 8.0; Windows NT 4.0; Trident/4.0),43.325539,-11.7186565,,,,,,Pink Floyd,Comfortably Numb,292
1706413761,5958,/playlists,Logged In,free,8,da Mata,59067354-220,AL,Opera/9.96.(Windows NT 10.0; apn-IN) Presto/2.9.182 Version/10.00,103.547485,-89.559008,91007.0,Scott,Suzanne,F,1706564736.0,Rihanna,Stay,260
1707692611,1105,/songs,Logged Out,free,54,South Lisastad,,NL,"Mozilla/5.0 (iPad; CPU iPad OS 12_4_4 like Mac OS X) AppleWebKit/536.2 (KHTML, like Gecko) CriOS/62.0.863.0 Mobile/29O927 Safari/536.2",169.803317,-81.4565785,,,,,,Prince,1999,187
1705567395,1986,/songs,Logged Out,free,69,Kimberlyhaven,,MN,Mozilla/5.0 (Macintosh; PPC Mac OS X 10_6_5; rv:1.9.5.20) Gecko/6555-08-08 17:18:17 Firefox/3.8,-178.635181,12.3386925,,,,,,Whitney Houston,How Will I Know,264
1705586501,356,/discover,Logged In,paid,84,Lopes,03110559-875,CE,Mozilla/5.0 (Windows NT 10.0; gv-GB; rv:1.9.0.20) Gecko/4924-08-04 19:48:54 Firefox/9.0,15.103477,63.638759,39990.0,Everett,Paul,F,1705743486.0,Bruce Springsteen,The River,218
1706058508,6912,/my-music,Logged In,free,93,Lisahaven,28073,KS,Mozilla/5.0 (compatible; MSIE 5.0; Windows 98; Win 9x 4.90; Trident/5.1),-79.414053,-73.537887,93332.0,Morgan,James,F,1707184437.0,Prince,Purple Rain,220
1706425067,7278,/new-releases,Logged Out,free,23,Techer,,,"Mozilla/5.0 (iPad; CPU iPad OS 9_3_6 like Mac OS X) AppleWebKit/535.2 (KHTML, like Gecko) CriOS/23.0.802.0 Mobile/55E089 Safari/535.2",-80.400408,-8.21358,,,,,,Taylor Swift,Shake It Off,253
1706506117,8688,/songs,Logged In,paid,32,Castro da Serra,16925-783-464,PA,"Mozilla/5.0 (Windows NT 5.0) AppleWebKit/534.1 (KHTML, like Gecko) Chrome/47.0.886.0 Safari/534.1",-5.532227,53.0247585,41564.0,Cruz,Maria,F,1705596913.0,Michael Jackson,Beat It,244
1705439140,3110,/new-releases,Logged Out,free,3,Romerofort,,MA,"Mozilla/5.0 (X11; Linux x86_64) AppleWebKit/532.1 (KHTML, like Gecko) Chrome/19.0.821.0 Safari/532.1",151.812006,-60.845641,,,,,,The Beatles,Help!,250
1706279890,291,/explore,Logged Out,free,60,Gallowayborough,,NB,"Mozilla/5.0 (Windows; U; Windows NT 5.1) AppleWebKit/533.32.7 (KHTML, like Gecko) Version/5.0.1 Safari/533.32.7",-138.405301,65.713383,,,,,,Rihanna,We Found Love,182
1704876422,9772,/new-releases,Logged Out,free,14,Teralfene,,,Mozilla/5.0 (Macintosh; Intel Mac OS X 10_6_8; rv:1.9.2.20) Gecko/5732-08-23 21:23:59 Firefox/3.8,-149.425686,50.4234455,,,,,,Elvis Presley,Love Me Tender,250
1708851191,5256,/playlists,Logged In,paid,27,da Conceição de Nascimento,52309-067-890,PE,"Mozilla/5.0 (Macintosh; PPC Mac OS X 10_10_6 rv:2.0; lt-LT) AppleWebKit/532.5.6 (KHTML, like Gecko) Version/5.1 Safari/532.5.6",47.859274,-42.013614,86654.0,Moore,Tiffany,F,1705732707.0,Led Zeppelin,Stairway to Heaven,183
1707188798,451,/songs,Logged In,paid,91,Lewisburgh,C2S 2L8,QC,Opera/8.26.(X11; Linux i686; fil-PH) Presto/2.9.172 Version/11.00,138.872876,68.251819,62840.0,Fowler,William,F,1706182260.0,Prince,Kiss,212
1708380529,3223,/my-music,Logged In,free,9,Muizen,4527,,"Mozilla/5.0 (Windows; U; Windows NT 4.0) AppleWebKit/532.4.4 (KHTML, like Gecko) Version/5.0.3 Safari/532.4.4",-137.501402,61.453502,69450.0,Webster,Jennifer,F,1704365165.0,Rihanna,Diamonds,199
1707736837,110,/playlists,Logged In,free,4,Marbais,9069,,"Mozilla/5.0 (Windows; U; Windows 95) AppleWebKit/532.4.4 (KHTML, like Gecko) Version/5.0.5 Safari/532.4.4",-119.10092,-84.2182345,98649.0,Lopez,Molly,F,1705615351.0,The Rolling Stones,Sympathy for the Devil,203
1706877129,354,/new-releases,Logged Out,free,18,Fernandezside,,ON,Mozilla/5.0 (Android 9; Mobile; rv:24.0) Gecko/24.0 Firefox/24.0,-83.05474,-79.0270875,,,,,,Madonna,Frozen,192
1706806820,8650,/artists,Logged In,free,100,Camus-la-Forêt,68276,,Mozilla/5.0 (compatible; MSIE 8.0; Windows NT 11.0; Trident/3.0),172.327902,-7.8085915,96318.0,Hill,Lawrence,M,1706506500.0,Led Zeppelin,Kashmir,253
1708508713,596,/new-releases,Logged Out,free,5,Ruiz-sur-Aubert,,,Mozilla/5.0 (compatible; MSIE 7.0; Windows NT 5.01; Trident/4.0),-113.573996,-83.132233,,,,,,The Rolling Stones,Angie,223
1704660073,1167,/explore,Logged In,paid,21,Brito,78711424-579,PE,Mozilla/5.0 (Android 8.0.0; Mobile; rv:6.0) Gecko/6.0 Firefox/6.0,172.591359,-89.170227,69666.0,Martinez,Shelly,F,1707837795.0,Frank Sinatra,The Way You Look Tonight,211
1708791626,8850,/explore,Logged Out,free,7,Brunel-sur-Moreno,,,Mozilla/5.0 (Android 5.1; Mobile; rv:60.0) Gecko/60.0 Firefox/60.0,-160.933934,-62.188396,,,,,,Bruce Springsteen,Born to Run,282
1708621586,3175,/songs,Logged Out,free,19,South Christopher,,BC,Mozilla/5.0 (Macintosh; Intel Mac OS X 10_6_3; rv:1.9.3.20) Gecko/2142-03-14 10:01:50 Firefox/3.8,-16.273728,30.4834955,,,,,,Taylor Swift,Shake It Off,253
1707567863,6214,/explore,Logged Out,free,3,Joelshire,,NB,"Mozilla/5.0 (Windows; U; Windows NT 5.0) AppleWebKit/531.18.4 (KHTML, like Gecko) Version/4.0 Safari/531.18.4",90.687616,46.413878,,,,,,Madonna,Like a Virgin,248
